<?xml version="1.0" encoding="UTF-8"?>
<!-- DTD tady musi byt!!! -->
<!DOCTYPE konfigurak SYSTEM "psimulator.dtd">

<konfigurak>
<pocitac jmeno="linux1" typ="linux">
	<rozhrani>
		<jmeno>eth1</jmeno>
		<ip>1.1.1.2</ip>
		<maska>255.255.255.0</maska>
		<mac>00:01:02:03:04:05</mac>
		<pripojenoK>cisco1:FastEthernet0/0</pripojenoK>
		<nahozene>true</nahozene>
	</rozhrani>
	<routy>
		<zaznam>
			<adresat>1.1.1.0</adresat>
			<maskaAdresata>255.255.255.0</maskaAdresata>
			<rozhraniKam>eth1</rozhraniKam>
		</zaznam>
	</routy>
	<ip_forward>0</ip_forward>
	<natovani>
		<pooly>
		</pooly>
		<prirazeniVice>
		</prirazeniVice>
		<access-listy>
		</access-listy>
	</natovani>
</pocitac>

<pocitac jmeno="cisco1" typ="cisco">
	<rozhrani>
		<jmeno>FastEthernet0/0</jmeno>
		<ip>1.1.1.254</ip>
		<maska>255.255.255.0</maska>
		<mac>00:0b:0c:0d:0a:01</mac>
		<pripojenoK>linux1:eth1</pripojenoK>
		<nahozene>true</nahozene>
	</rozhrani>
	<rozhrani>
		<jmeno>FastEthernet0/1</jmeno>
		<ip>2.2.2.1</ip>
		<maska>255.255.255.0</maska>
		<mac>03:08:b7:30:24:e1</mac>
		<pripojenoK>cisco2:FastEthernet0/0</pripojenoK>
		<nahozene>true</nahozene>
	</rozhrani>
	<routy>
	</routy>
	<natovani>
		<pooly>
		</pooly>
		<prirazeniVice>
		</prirazeniVice>
		<access-listy>
		</access-listy>
	</natovani>
</pocitac>

<pocitac jmeno="cisco2" typ="cisco">
	<rozhrani>
		<jmeno>FastEthernet0/0</jmeno>
		<ip>2.2.2.254</ip>
		<maska>255.255.255.0</maska>
		<mac>00:0b:0c:0d:0a:01</mac>
		<pripojenoK>cisco1:FastEthernet0/1</pripojenoK>
		<nahozene>true</nahozene>
	</rozhrani>
	<routy>
		<zaznam>
			<adresat>1.1.1.0</adresat>
			<maskaAdresata>255.255.255.0</maskaAdresata>
			<brana>2.2.2.0</brana>
		</zaznam>
	</routy>
	<natovani>
		<pooly>
		</pooly>
		<prirazeniVice>
		</prirazeniVice>
		<access-listy>
		</access-listy>
	</natovani>
</pocitac>

<kabelaz>
	<kabel>
		<prvni>linux1:eth1</prvni>
		<druhy>cisco1:FastEthernet0/0</druhy>
	</kabel>
	<kabel>
		<prvni>cisco1:FastEthernet0/1</prvni>
		<druhy>cisco2:FastEthernet0/0</druhy>
	</kabel>
</kabelaz>
</konfigurak>
