<?xml version="1.0" encoding="UTF-8"?>
<!-- DTD tady musi byt!!! -->
<!DOCTYPE konfigurak SYSTEM "psimulator.dtd">

<konfigurak>
<pocitac jmeno="linux1" typ="linux">
	<rozhrani>
		<jmeno>eth0</jmeno>
		<ip>192.168.1.1</ip>
		<maska>255.255.255.0</maska>
		<mac>00:01:02:03:04:05</mac>
		<nahozene>true</nahozene>
	</rozhrani>
	<routy>
		<zaznam>
			<adresat>192.168.1.0</adresat>
			<maskaAdresata>255.255.255.0</maskaAdresata>
			<rozhraniKam>eth0</rozhraniKam>
		</zaznam>
		<zaznam>
			<adresat>0.0.0.0</adresat>
			<maskaAdresata>0.0.0.0</maskaAdresata>
			<brana>192.168.1.2</brana>
			<rozhraniKam>eth0</rozhraniKam>
		</zaznam>
	</routy>
	<ip_forward>0</ip_forward>
	<natovani>
		<pooly>
		</pooly>
		<prirazeniVice>
		</prirazeniVice>
		<access-listy>
		</access-listy>
	</natovani>
</pocitac
>
<pocitac jmeno="linux2" typ="linux">
	<rozhrani>
		<jmeno>eth0</jmeno>
		<ip>192.168.1.2</ip>
		<maska>255.255.255.0</maska>
		<mac>00:01:02:03:04:05</mac>
		<nahozene>true</nahozene>
	</rozhrani>
	<rozhrani>
		<jmeno>eth1</jmeno>
		<ip>192.168.2.1</ip>
		<maska>255.255.255.192</maska>
		<mac>00:01:02:03:04:05</mac>
		<nahozene>true</nahozene>
	</rozhrani>
	<routy>
		<zaznam>
			<adresat>192.168.2.0</adresat>
			<maskaAdresata>255.255.255.192</maskaAdresata>
			<rozhraniKam>eth1</rozhraniKam>
		</zaznam>
		<zaznam>
			<adresat>192.168.1.0</adresat>
			<maskaAdresata>255.255.255.0</maskaAdresata>
			<rozhraniKam>eth0</rozhraniKam>
		</zaznam>
		<zaznam>
			<adresat>0.0.0.0</adresat>
			<maskaAdresata>0.0.0.0</maskaAdresata>
			<brana>192.168.2.2</brana>
			<rozhraniKam>eth1</rozhraniKam>
		</zaznam>
	</routy>
	<ip_forward>1</ip_forward>
	<natovani>
		<pooly>
		</pooly>
		<prirazeniVice>
		</prirazeniVice>
		<access-listy>
		</access-listy>
	</natovani>
</pocitac
>
<pocitac jmeno="cisco1" typ="cisco">
	<rozhrani>
		<jmeno>FastEthernet0/0</jmeno>
		<ip>192.168.2.2</ip>
		<maska>255.255.255.192</maska>
		<mac>00:0b:0c:0d:0a:01</mac>
		<nahozene>true</nahozene>
		<nat>soukrome</nat>
	</rozhrani>
	<rozhrani>
		<jmeno>FastEthernet0/1</jmeno>
		<ip>10.0.0.1</ip>
		<maska>255.255.255.248</maska>
		<mac>03:08:b7:30:24:e1</mac>
		<nahozene>true</nahozene>
		<nat>verejne</nat>
	</rozhrani>
	<routy>
		<zaznam>
			<adresat>192.168.1.0</adresat>
			<maskaAdresata>255.255.255.0</maskaAdresata>
			<brana>192.168.2.1</brana>
		</zaznam>
	</routy>
	<natovani>
		<pooly>
			<pool>
				<pJmeno>o1</pJmeno>
				<ip_start>10.0.0.5</ip_start>
				<ip_konec>10.0.0.5</ip_konec>
				<prefix>24</prefix>
			</pool>
			<pool>
				<pJmeno>o2</pJmeno>
				<ip_start>10.0.0.77</ip_start>
				<ip_konec>10.0.0.80</ip_konec>
				<prefix>24</prefix>
			</pool>
		</pooly>
		<prirazeniVice>
			<prirazeni>
				<accessCislo>7</accessCislo>
				<poolJmeno>o1</poolJmeno>
				<overload>true</overload>
			</prirazeni>
		</prirazeniVice>
		<access-listy>
			<access-list>
				<cislo>7</cislo>
				<ipA>192.168.2.1</ipA>
				<ipAWildcard>0.0.0.3</ipAWildcard>
			</access-list>
		</access-listy>
		<staticke>
			<in>192.168.1.1</in>
			<out>10.0.0.6</out>
		</staticke>
	</natovani>
</pocitac
>
<pocitac jmeno="cisco2" typ="cisco">
	<rozhrani>
		<jmeno>FastEthernet0/0</jmeno>
		<ip>10.0.0.2</ip>
		<maska>255.255.255.248</maska>
		<mac>00:0b:0c:0d:0a:01</mac>
		<nahozene>true</nahozene>
	</rozhrani>
	<rozhrani>
		<jmeno>FastEthernet0/1</jmeno>
		<ip>147.32.125.129</ip>
		<maska>255.255.255.128</maska>
		<mac>00:0b:0c:0d:0a:10</mac>
		<nahozene>true</nahozene>
	</rozhrani>
	<routy>
	</routy>
	<natovani>
		<pooly>
		</pooly>
		<prirazeniVice>
		</prirazeniVice>
		<access-listy>
		</access-listy>
	</natovani>
</pocitac
>
<kabelaz>
	<kabel>
		<prvni>linux1:eth0</prvni>
		<druhy>linux2:eth0</druhy>
	</kabel>
	<kabel>
		<prvni>linux2:eth1</prvni>
		<druhy>cisco1:FastEthernet0/0</druhy>
	</kabel>
	<kabel>
		<prvni>cisco1:FastEthernet0/1</prvni>
		<druhy>cisco2:FastEthernet0/0</druhy>
	</kabel>
</kabelaz>
</konfigurak>
